reason,user_id,first_name,last_name,url,phone,instagram,youtubepage,location,address,latitude,longitude,shortabout,about
missing_user_id,0,NULL,NULL,NULL,NULL,NULL,NULL,NULL,NULL,NULL,NULL,NULL,NULL
missing_user_id,1,VoiceoverGuy - Yorkshire Voice Recording Studio,NULL,https://www.voiceoverguy.co.uk,07973350178,,https://www.youtube.com/user/voiceoverguyharris,United Kingdom,205 Batley Rd, Kirkhamgate, Wakefield WF2 0SH, UK,53.7006629,-1.5520954,Broadcast quality Studio in West Yorkshire. Audiobook, Podcasts, Commercials, interviews, training film recording and more.,A broadcast quality studio for hire in West Yorkshire in the UK.
missing_user_id,Suitable for Audiobook voiceover recording, Interviews including down the line interviews connecting with broadcasters worldwide, Podcast interviews, commercial or training video voice recordings and any form of recording spoken word in a beautiful comfortable studio in West Yorkshire.,,,,,,,,,,,,
missing_user_id,A favourite of Emmerdale television stars and Kammy Chris Kamara,,,,,,,,,,,,
missing_user_id,Kit includes Neumann U87, TLM 103 and Sennheiser mk416 Mics. Apollo X4 &amp; X6. Neve pre amps,,,,,,,,,,,,
missing_user_id,Perfectly treated acoustic voiceover booth for standing or seated voiceover recordings.,,,,,,,,,,,,
missing_user_id,As a British Male Voiceover, my own voiceover clients include Apple, Tesco, RBS, Vodafone, SAGE, BBC TV, ITV, Radio 2, LEGO, Centre Parcs, Butlins, Asda, Hotels.com among others.,,,,,,,,,,,,
missing_user_id,The studio can be booked per hour and includes an engineer. The rates listed are subject to VAT.,,,,,,,,,,,,
missing_user_id,Free parking on site.,,,,,,,,,,,,
missing_user_id,2,,,,,NULL,NULL,,NULL,NULL,NULL,NULL,
missing_user_id,1801,Natalie,Walsh,,,https://www.instagram.com/missnataliewalsh/,,Worldwide,NULL,NULL,NULL,,Dancer. Choreographer. Actress. Creative.
missing_user_id,1848,VoiceoverGuy - Yorkshire Voice Recording Studio,NULL,https://www.voiceoverguy.co.uk,07973350178,,https://www.youtube.com/user/voiceoverguyharris,United Kingdom,205 Batley Rd, Kirkhamgate, Wakefield WF2 0SH, UK,53.7006629,-1.5520954,Broadcast quality Studio in West Yorkshire. Audiobook, Podcasts, Commercials, interviews, training film recording and more.,A broadcast quality studio for hire in West Yorkshire in the UK.
missing_user_id,Suitable for Audiobook voiceover recording, Interviews including down the line interviews connecting with broadcasters worldwide, Podcast interviews, commercial or training video voice recordings and any form of recording spoken word in a beautiful comfortable studio in West Yorkshire.,,,,,,,,,,,,
missing_user_id,A favourite of Emmerdale television stars and Kammy Chris Kamara,,,,,,,,,,,,
missing_user_id,Kit includes Neumann U87, TLM 103 and Sennheiser mk416 Mics. Apollo X4 &amp; X6. Neve pre amps,,,,,,,,,,,,
missing_user_id,Perfectly treated acoustic voiceover booth for standing or seated voiceover recordings.,,,,,,,,,,,,
missing_user_id,As a British Male Voiceover, my own voiceover clients include Apple, Tesco, RBS, Vodafone, SAGE, BBC TV, ITV, Radio 2, LEGO, Centre Parcs, Butlins, Asda, Hotels.com among others.,,,,,,,,,,,,
missing_user_id,The studio can be booked per hour and includes an engineer. The rates listed are subject to VAT.,,,,,,,,,,,,
missing_user_id,Free parking on site.,,,,,,,,,,,,
missing_user_id,1851,S2Blue,NULL,http://www.s2blue.com/,0161 905 2662,,,United Kingdom,,53.4288316,-2.342828999999938,S2Blue is the innovative audio company that produce voiceovers, music, jingles, radio and TV commercials.,Over the years we have cultivated an impressive client base, which includes all of the major broadcasters in British media. Our productions have been heard on radio and TV stations across the world.
missing_user_id,In the UK our work has aired on BBC, Global Radio, Bauer, SKY, ITV, MTV, Discovery Network as well as many other ILR and local radio stations.,,,,,,,,,,,,
missing_user_id,Our professional broadcast-quality studio is equipped with the latest ProTools Software. The S2Blue Production team are experienced in a wide range of audio projects, including broadcast commercials and Corporate projects in multiple languages.&nbsp;,,,,,,,,,,,,
missing_user_id,We can record remotely using Cleanfeed, Source Connect, or ISDN, and our sessions are easily accessible for clients to attend either in person or via Skype, Zoom, or Phone Patch.&nbsp;,,,,,,,,,,,,
missing_user_id,We can offer discounted rates for larger projects and will always do our best to accommodate last minute bookings where we can - just give us a call!,,,,,,,,,,,,
missing_user_id,1852,Get Carter,NULL,http://www.getcarterproductions.co.uk/,,,,United Kingdom,7 Keel Row, Gateshead NE11 9SZ, UK,54.96380051712476,-1.677061427122453,Get Carter Productions. Radio - TV/Video - Telecoms - Voiceovers - Music Licensing,Paul is the founder and Managing Director of Get Carter Productions. He&rsquo;s worked for radio groups across the UK, rising through the ranks to the level of Radio Group Creative Director, before launching his own company in 2001. He&rsquo;s won many awards, including the highly coveted New York Radio Festivals and London Internationals. Paul creates campaigns for clients including: Jet 2, Bristol Street Motors and Safestyle UK.
missing_user_id,1854,Audio Take,NULL,http://www.audiotake.co.uk,+44(0)1202 253599,,,United Kingdom,4 Terrace Rd, Bournemouth BH2 5AN, UK,50.719164,-1.8807689999999866,Audio post production recording studio based in Bournemouth UK,Post Production, Music composition, Sound Design, Voice-overs,
missing_user_id,TV Commercials, Radio promos, Cinema Ads, Online videos, Games &amp; apps.,,,,,,,,,,,,
missing_user_id,1856,BKP Media Group,NULL,http://www.bkpmediagroup.com/,+971 (0) 4 448 3600,https://www.instagram.com/bkpmediagroup/,https://www.youtube.com/user/bkpmediagroup,United Arab Emirates,Business Central Towers - Dubai - United Arab Emirates,25.100636005412095,55.17004170645919,BKP Media Group is the leading audio post production and music production company in the middle east.,World class production company specializing in music, audio &amp; video post production and video production
missing_user_id,BKP Media Group is the leading audio post production and music production company in the middle east.,,,,,,,,,,,,
missing_user_id,Established in Dubai media city for 10 years, BKP Media Group has provided the area with award winning,,,,,,,,,,,,
missing_user_id,media production solutions.,,,,,,,,,,,,
missing_user_id,1863,A1 Vox,NULL,http://a1vox.com,020 7434 4404,,,United Kingdom,20 Old Compton St, West End, London W1D 4TW, UK,51.5137204,-0.13032769999995253,London&rsquo;s friendliest sound studio,Established in 1998. A1 VOX quickly built a reputation as Soho&rsquo;s friendliest sound studio.
missing_user_id,We&rsquo;re bright, flexible, informal, efficient. Always ready to help and always up for adventure - we love an audio challenge! A1 VOX, the Spoken Word audio specialists, for recordings and remote links to anywhere by ISDN, Source Connect, Audio-over-IP.,,,,,,,,,,,,
missing_user_id,Voice-over artists available too - why not fix your studio and voice requirements in just one call?,,,,,,,,,,,,
missing_user_id,1864,Radio Jingles,NULL,https://radiojingles.com,01803 322699,,,United Kingdom,198 Lymington Rd, Torquay TQ1 4AR, UK,50.475381,-3.5364130000000387,Your Company and it&rsquo;s product is what we make interesting to the public,We have fully equipped studios within our Torquay, Devon premises that have all the up-to-date computerised audio recording software for all types of Radio Advertising.
missing_user_id,Radio Jingles has scriptwriters that are engaged in producing the voices and scripts that project your company&rsquo;s audio-image, that is memorable and distinct within the commercial advertising production.,,,,,,,,,,,,
missing_user_id,Jingle production is something we excel in. Radiojingles can make your Company and it&rsquo;s Product stand out from the crowd.,,,,,,,,,,,,
missing_user_id,1865,Canongate Studios Edinburgh,NULL,http://www.canongate.com,(0)131 555 4455,,https://www.youtube.com/user/canongatestudios,United Kingdom,2-3 Waters&#039; Cl, Leith, Edinburgh EH6 6RB, UK,55.9754312,-3.170265400000062,Audio Post Production ADR ISDN Source Connect ipDTL Vo&rsquo;s,London designed ISDN Skype ADR &amp; Source Connect Audio Post Production recording studio in Edinburgh Scotland.
missing_user_id,We regularly record for BBC TV, ITV and Radio. Vast Voice Bank. Protools 11,,,,,,,,,,,,
missing_user_id,1866,Voiceover Kickstart,NULL,http://www.voice-reel.com,07973 445328,https://www.instagram.com/voiceoverkickstart,https://www.youtube.com/channel/UCeDxtfNzfQzssq-z5wS2iXw,United Kingdom,22 Tewkesbury Terrace, London N11 2LT, UK,51.6096983,-0.12913159999993695,Supercharging Voicer Careers Since 2006,DEMO PRODUCTION
missing_user_id,Producer Guy Michaels has worked with nearly 800 clients since 2006.  This truly bespoke service, based in North London is unique, personal and to broadcast standards,,,,,,,,,,,,
missing_user_id,HISTORY + FACILITY,,,,,,,,,,,,
missing_user_id,2016 marks the 10th Anniversary of Round Island Voicereels - Round Island becomes Voiceover Kickstart during 2016.   Guy limits to working with just 2 clients a week giving full focus and dedication, resulting in a showreel that stands outs and represents the best of you.,,,,,,,,,,,,
missing_user_id,TRAINING &amp; COACHING,,,,,,,,,,,,
missing_user_id,Having taught voice+acting at RADA, GSA, Actors Guild, Actors Centre and more, Guy regularly works one-to-one in microphone and performance techniques.,,,,,,,,,,,,
missing_user_id,Join the FREE 6 week programme at http://www.roundisland.net/vok-signup,,,,,,,,,,,,
missing_user_id,1868,STL Audio,NULL,http://www.stlaudio.co.nz/,(04) 801 5602,https://www.instagram.com/stlaudio/,,New Zealand,16 Marion Street, Te Aro, Wellington 6011, New Zealand,-41.2941456,174.77627529999995,Located in central Wellington, STL Audio specializes in providing one of the most,
missing_user_id,creative, professional and affordable recording studios,Our services include Music Recording, Mixing &amp; Mastering, Voice-overs,,,,,,,,,,,,
missing_user_id,all Post Production and even rehearsal spaces.,,,,,,,,,,,,
missing_user_id,Our recording studio is a stones throw from Cuba Street&rsquo;s cafes &ndash; just step outside and,,,,,,,,,,,,
missing_user_id,you will be immersed in the creative culture that Wellington is world famous for.,,,,,,,,,,,,
missing_user_id,1869,Mike Cooper,NULL,http://www.MikeCooperVoiceover.com,+1 (828) 333-5020,,http://youtube.com/MikeCooperVoiceover,United States,,35.4989049,-82.71313199999997,British Voice Over Artist in America &ndash;,
missing_user_id,based just outside Asheville, NC,A great home studio with a view of Mt Pisgah, nestled in Hominy Valley, 25 minutes from downtown Asheville in Pisgah National Forest.,,,,,,,,,,,
missing_user_id,I have a broadcast quality phone patch and can connect with all the VOIP codecs (BYO login) or with ISDN (via bridge).,,,,,,,,,,,,
missing_user_id,My own voiceover work includes broadcast narrations for HISTORY, National Geographic and others, as well as corporate narrations for some of the biggest brands in the world.,,,,,,,,,,,,
missing_user_id,Contact me for studio hire &ndash; or to book me for your own project!,,,,,,,,,,,,
missing_user_id,1870,Little Monster Media,NULL,http://www.littlemonstermedia.co.uk,,,,United Kingdom,Wyndham Way, Portishead, Bristol, North Somerset BS20 6EW, UK,51.485155,-2.767947999999933,Independant production house specialising in radio imaging, sound design FX and audio branding.,Independant production house specialising in radio imaging, sound design FX and audio branding. Other services include DJ set intros, voiceover showreels, and audio editing.
missing_user_id,1872,Stevie Cripps,NULL,http://steviecripps.com,07540620006,,,United Kingdom,66 Lynwood Dr, Oakley, Wimborne BH21 1UQ, UK,50.77987630000001,-1.9672491000000036,A young, yet exceptionally experienced voice, Stevie is a naturally strong, cool, confident sounding guy, with a little edge.,A young, yet exceptionally experienced voice, Stevie&rsquo;s tones can be heard on a multitude of platforms for leading brands. From advertising skin care products, engaging a stadium of 30,000, or doing promo &amp; imaging for TV &amp; radio, he&rsquo;s a naturally strong, cool, credible sounding guy, with a little edge &ndash; and very creative, too! BBC TV &amp; Radio 1, Nivea, Virgin Media, Coca Cola, HP, Nickelodeon, Speedo, Red Bull, Paramount, Selfridges. Can connect via ISDN, Skype  &amp;  Source Connect NOW!
missing_user_id,1873,Sixty Six Sound,NULL,http://sixtysixsound.com,01202237266,,,United Kingdom,66 Lynwood Dr, Oakley, Wimborne BH21 1UQ, UK,50.77987630000001,-1.9672491000000036,Sixty Six Sound are specialists in radio imaging and production, including jingles and idents as well as live show openers.,Sixty Six Sound are specialists in radio imaging and production, including jingles and idents as well as live show openers. We take a fresh look at every project and using the latest plug-ins, sound design tools and techniques along with a vast array of voices to ensure that every piece we produce is unique. This is our insistence &ndash; no catalogues or libraries of old work rehashed for new shows. We only make new imaging, every time.
missing_user_id,1874,Wright Communicators,NULL,http://www.wrightcommunicators.com,01993 849 444,,,United Kingdom,Masonic Hall, 20 Church Green, Witney OX28 4AW, UK,51.7822318,-1.4853716999999733,Wright Communicators Oxfordshire is a Protools audio Post suite, an Avid post production Video suite and Voice over facility.,We offer expert voice direction and world class audio and video post production editing.
missing_user_id,1876,Ben McAuley,NULL,http://www.benmcauley.co.uk,07984 437430,https://www.instagram.com/voiceactorben/,https://youtu.be/9OYweAGcJCA,United Kingdom,,52.22201351438994,-0.14028928051743828,Professional studio with Vocal Booth, Source Connect, IpDTL and Skype, just 20 minutes from central Cambridge, UK.,Full-time, award-winning, professional voiceover Ben McAuley, provides voiceovers worldwide from his vocal booth.  Remote sessions are made easy via Source Connect, IpDTL, Skype or phone patch. Situated just 20 minutes from the centre of Cambridge and ten minutes from the M11 &amp; A14, Ben&#039;s studio is easily accessible and highly cost effective.
missing_user_id,1877,Hire British Voiceover: Joe Wakeford,NULL,https://www.joewakeford.com/,,https://instagram.com/joewakeford,https://www.youtube.com/joewakefordvoiceovers,United Kingdom,166 High St, Guildford GU1 3HR, UK,51.23622,-0.5704090000000406,Hire British Voiceover: Joe Wakeford,I&#039;m a professional British English voiceover artist as heard this year on TV commercials for GoDaddy, Flora Gold &amp; &quot;Star Wars: Episode VII - The Force Awakens&quot;, on promos for Booking.com, Jaguar, Marks &amp; Spencer, Coca-Cola, Dell, Expedia, Starbucks, Johnson &amp; Johnson, Mercedes-Benz, Cisco, MasterCard, Chevrolet, Ikea, Samsung, Aegon, Unilever, Toshiba, HP, Alfa Romeo, Absolut Vodka, Carlsberg, Madame Tussauds, Microsoft, Admiral Insurance, bank adverts, the BBC and documentary narration with millions of views.
missing_user_id,1879,Cromerty York Voice-Overs,NULL,https://alteregovoices.com/,07786585995,,https://www.youtube.com/c/CromertyYorkBritishFemaleVoiceOver,United Kingdom,7 Roxby Cl, Elvington, York YO41 4EJ, UK,53.9212308,-0.9354499000000001,Finding a handy studio in the North of England is no longer a problem. Click now for more details!,A professional studio based in the Yorkshire Moors. Offering direction in English, French, German and Spanish with ISDN, ipDTL and Source Connect. I&#039;m an experienced voice-over heard in the UK and world-wide. Contact me today!
missing_user_id,1880,Phantom City Studio,NULL,http://www.phantomcitystudio.com/,,,,United Kingdom,9151 Kilgore Rd, Orlando, FL 32836, USA,28.4319307,-81.50833690000002,The recording studio is noted for its work with famous celebrities like Shaquille O&#039;Neal, Miley Cyrus, Justin Bieber, Eminem  &amp; Snoop Dogg,At Phantom City Studio every artist
missing_user_id,has a chance to be a star!,,,,,,,,,,,,
missing_user_id,We believe studio sessions should be,,,,,,,,,,,,
missing_user_id,fun, private, and professional.,,,,,,,,,,,,
missing_user_id,Our Pro Tools certified engineers,,,,,,,,,,,,
missing_user_id,operate at fast speeds without,,,,,,,,,,,,
missing_user_id,compromising the quality of your,,,,,,,,,,,,
missing_user_id,project.,,,,,,,,,,,,
missing_user_id,You will work one-on-one with some,,,,,,,,,,,,
missing_user_id,of the most talented audio engineers,,,,,,,,,,,,
missing_user_id,in the music industry.,,,,,,,,,,,,
missing_user_id,Our goal is to provide the best studio,,,,,,,,,,,,
missing_user_id,experience possible!,,,,,,,,,,,,
missing_user_id,1881,Miller The Voice,NULL,www.millerthevoice.com,,,,United Kingdom,8A Ireton St, Beeston, Nottingham NG9 1FD, UK,52.92556580000001,-1.2217461,,
missing_user_id,1882,VoicesUK&reg; - Hire British Voiceovers,NULL,https://www.voicesuk.co.uk/,,https://www.instagram.com/voicesus,https://www.youtube.com/channel/UCkRCdIdmw2xZ5Vb3yuPAsjg,United Kingdom,164 High St, Guildford GU1 3HR, UK,51.23622,-0.5704090000000406,Hire curated British voiceovers for every type of media project. Run by voice artists, loved by production companies.,Launched in 2013, VoicesUK is the award-winning platform for finding British voiceovers from our pool of seasoned &amp; upcoming talent. Search for your perfect fit and message the artist for availability &amp; current rates or post a project for us to assist you in your search. In 2016 we won two awards at the Surrey Digital Awards honouring outstanding online businesses. 2015 saw us recognised as one of former Dragon&#039;s Den investor Theo Paphitis&#039;s top companies. Read our FAQ for more information.
missing_user_id,1883,VoicesUS - Hire North American Voiceovers,NULL,http://www.voicesus.com/,,https://www.instagram.com/voicesus/,https://www.youtube.com/c/Voicesuscom,United States,254 Broadway, New York, NY 10007, USA,40.7127837,-74.00594130000002,Hire curated North American voiceovers for every type of media project. Run by voice artists, loved by production companies.,Launched in early 2015, VoicesUS is the place to find Emmy award-winning U.S. &amp; Canadian voiceovers from our pool of seasoned &amp; upcoming talent. Search for your perfect fit &amp; message the artist for availability and current rates or drop us an email for us to assist you in your search.
missing_user_id,1884,Darren Altman,NULL,https://www.darrenaltman.com/,07778577464,https://www.instagram.com/darrenaltman_vo,https://www.youtube.com/user/UKVoiceoverGuy,United Kingdom,6 St Philip&#039;s Ave, Worcester Park KT4 8JT, UK,51.3776154,-0.2381325,Broadcast quality VoiceOver studio in SW London/Surrey. Neumann U87, latest iMac , Adobe Audition CC and acoustically treated.,My studio has been used to record national TV  and radio ads all over the world and is a unique bespoke design, It is a &quot;room within a room&quot; meaning that no walls, ceiling or floor are touching the outside walls, so there are no vibrations and no external sounds will creep in. It&#039;s completely acoustically treated and has a double sealed door and window system, to ensure no sound permeates the space.
missing_user_id,It is equipped with, Skype, Source Connect, IPdtl, Zoom and CleanFeed to connect with studios all over the world.,,,,,,,,,,,,
missing_user_id,I&#039;m also happy to edit your work for you if you require and direct you during your session.,,,,,,,,,,,,
missing_user_id,1886,Maple Street Studios,NULL,http://maplestreetstudios.co.uk/,44(0)20 7907 0690,https://www.instagram.com/explore/locations/1005455/,,United Kingdom,,51.52204883531562,-0.139176250926198,We are based in the heart of London&rsquo;s media district in W1. Come and visit our spacious studio complex.,The voice booth is where the voice talent brings audio to life, so it&rsquo;s only right that we give them the best possible conditions to do so. Our voice booth is a large, spacious room situated between our two studios.
missing_user_id,We can comfortably sit four people around the table in our voice booth &ndash; this is an excellent set up for long form recording such as audio books, narration, podcasts and round table discussions. We use four Neumann KMS 105 mics around the table and we have Neumann TLM 103 and Neumann BCM 104 mics available when standing.,,,,,,,,,,,,
missing_user_id,1887,Lee Glasby Voice Over Services,NULL,http://www.leeglasbyvoiceover.co.uk,07017 414 434,http://instagram.com/leeglasbyvo,,United Kingdom,11 Mill St, Clowne, Chesterfield S43 4JN, UK,53.27422000000001,-1.2652699000000212,UK British Voice Over for TV, Radio &amp; Corporate. Fully professional home studio. Clients include Ford, The United Nations, Meadowhall.,UK British Voice Over with professional home studio used daily. Featuring Neumann TLM 103, Rode NT1, Audition CS6 for session editing, Focusrite Red, Ozone 7 and Nectar plug ins. My voice has been used on many corporate projects including on-hold, website audio, corporate videos and promotional content for clients. I&#039;ve also voiced many radio commercials and radio station imaging for stations worldwide.
missing_user_id,High Quality Voice Over booth and studio for hire. Please contact me for availability.,,,,,,,,,,,,
missing_user_id,1889,Creative Media Recording,NULL,http://creativemediarecording.com/,714 892-9469,,,United States,11105 Knott Ave, Cypress, CA 90630, USA,33.8011673,-118.014096,Professional comfortable studios for voice recording, editing &amp; mixing, VO demo creation, ISDN connections - 5 Miles from DISNEYLAND,****FIVE miles from DISNEYLAND****
missing_user_id,Owner Tim Keenan has produced thousands of audio projects for a diversified base of clients including eLearning, automotive, medical, financial, food service industries as well as commercials for advertising agencies. Projects include recording, editing &amp; audio sweetening as well as foreign language versioning. CMR has helped clients gain national recognition by producing award winning audio on hundreds of projects.,,,,,,,,,,,,
missing_user_id,Services for VO talent include DEMO creation along with phone patch &amp; ISDN connections.,,,,,,,,,,,,
missing_user_id,**Near the Anaheim Convention Center**,,,,,,,,,,,,
missing_user_id,1890,Richard Di Britannia - HelloVoiceover.com,NULL,http://hellovoiceover.com/,,,,United Kingdom,90 Summer St, Sheffield S3 7NT, UK,53.38442420000001,-1.4875459,Richard Di Britannia - Voice Actor and Communication Coach,Richard Di Britannia is a speech coach, author and voice actor whose services have been relied upon by hundreds of companies around the world.
missing_user_id,As a speech coach Richard has consulted for clients at Google, Amazon and Morgan Stanley on executive presentation, vocal confidence and public speaking.,,,,,,,,,,,,
missing_user_id,His unique, trustworthy and conversational voice acting skill has also been used by clients at Mercedes-Benz, Google and Amazon. Even the US Government has relied upon his professional British English accent not once, but twice.,,,,,,,,,,,,
missing_user_id,1891,Roger Woods VO,NULL,http://www.rogerwoodsvo.co.uk,+44 7501 368689,http://www.instagram.com/rogerwoodsvo,http://www.youtube.com/rogerwoodsvo,United Kingdom,8 Chapel St, Shipdham, Thetford IP25 7LB, UK,52.62957970000001,0.8956260544921406,Neumann TLM103, Sudient iD22 Audio Interface, Adobe Audition CC DAW + Esmono Isolation Booth. ipDTL / Source Connect,I have a voice described by my peers as articulate and assured, confident yet friendly, professional, warm and natural. It is full of colour!
missing_user_id,With more than 25 years experience in broadcasting and journalism, you&rsquo;ll find me easy to work with, fast, proficient and entertaining. Quick turnarounds and quality recordings ensure clients return time and again &ndash; my specialties include corporate explainers and e-learning courses, telephone on-hold messaging and IVR. In fact anything that can be given life with words.,,,,,,,,,,,,
missing_user_id,1893,Drew&#039;s Studio,NULL,http://www.voiceofdrew.com,07825183789,https://www.instagram.com/voiceofdrew111,https://www.youtube.com/channel/UC0UT_urGOXzvhNonkBQiJsA,United Kingdom,,54.8836399,-2.9511592000000064,Drew is an experienced, professional Voice Actor. A dynamic, enthralling and versatile voice for Your TV, Film, Radio or Commercial project.,Fully equipped soundproofed and acoustically treated garden studio. iMac 27&quot; and Intel Core i7 PC. Presonus Studio192 Mobile Audio Interface with grade A pre&#039;s. Rode NT1 and NT1a condenser mic&#039;s. PopAudio pop filter, KRK Rokit 5 4G Studio monitors.
missing_user_id,DAW: Cubase 7,,,,,,,,,,,,
missing_user_id,Audio editing services also available.,,,,,,,,,,,,
missing_user_id,1894,The Sound Pound,NULL,http://HQvoice.com,07887 746739,http://www.instagram.com/HQvoice,https://www.youtube.com/channel/UCrtStfRKo71vFfiAn_ihobw,United Kingdom,21 Coval Ave, Chelmsford CM1 1TF, UK,51.7361332,0.46178120000001854,A slightly Art Deco custom garden studio with booth built specifically for voiceover recording. Biscuits and cocktails. Sometimes.,4m x 3m acoustically treated garden room and 1.2m x 1.2m bespoke VO booth. Air-conditioned. Neumann &amp; Sontronic microphones. Biscuits, just like in Soho.
