reason,user_id,first_name,last_name,url,phone,instagram,youtubepage,location,address,latitude,longitude,shortabout,about
missing_user_id,2606,Radio Facilities Ltd.,NULL,https://www.radiofacilities.com/,020 3355 8188,https://instagram.com/radiofacilities/,,United Kingdom,14C Hammersmith Broadway, London W6 7AB, UK,51.4934692,-0.22432370000001356,Voiceover and ISDN studio in Hammersmith. Voiceover recording, PR days and ADR, providing ISDN connections to the UK and worldwide.,We record everything from voiceovers, audiobooks and podcasts to radio PR days and corporate audio. From our convenient west London location, we also offer ISDN connections across the UK and wordwide. We also host global broadcasters and connect spokespeople to countless radio stations every month.
missing_user_id,Enquire about studio rates for Voice Artists: call us on 020 3355 8188,,,,,,,,,,,,
missing_user_id,2607,Diktorius LT,NULL,https://www.diktorius.lt,+37062447430,https://www.instagram.com/uzkadrinisbalsas/,https://www.youtube.com/channel/UCDpd5Vyxrj8BKLitR_kF4dw,,Partizan g. 70, Kaunas 50351, Lietuva,54.92481199999999,23.972066900000073,Lithuanian voice over.,I&#039;ve been in the entertainment industry for over 10 years. I&#039;ve successfully recorded voice over for radio ads, narration, TV spots and the like.Now I`m working as voice over for movies.
missing_user_id,2608,NULL,NULL,NULL,NULL,NULL,NULL,NULL,NULL,NULL,NULL,NULL,NULL
missing_user_id,2609,NULL,NULL,NULL,NULL,NULL,NULL,NULL,NULL,NULL,NULL,NULL,NULL
missing_user_id,2615,Bonami Studios,NULL,https://www.instagram.com/bonamistudios/?hl=en-gb,07525483932,,,United Kingdom,,51.26815879999999,1.095404300000041,Bespoke Voiceover Studio in Canterbury, Kent. Specialising in Audiobooks, Podcasts, ADR, E-Learning, Voice Reels and Radio and Spotify Ads,Having produced audiobooks for some of the World&#039;s leading publishers, our engineers will ensure an immersive and high-quality production, what ever the project. As well as the post-production side of things, we also offer voice direction to ensure the brief is met and both the actor and client are happy and casting, so you can leave it up to us to find the perfect voice for your project.
missing_user_id,2619,Voice Artist Studio/Music Room,NULL,https://www.louisemccance-price.com,+44(0)77895-10297,,,United Kingdom,25 Chartfield Ave, London SW15 6DZ, UK,51.4576917,-0.2263757,Pro Studiobricks Audiobooth,Voiceover Artist Studiobricks Pro Acoustic Booth / Music Practice room
missing_user_id,Compact triple-walled home studio for all your voice over needs.,,,,,,,,,,,,
missing_user_id,Voice actor can record either standing up or sitting down.,,,,,,,,,,,,
missing_user_id,EQUIPMENT,,,,,,,,,,,,
missing_user_id,Mic: Sennheiser MKH416,,,,,,,,,,,,
missing_user_id,Interface: Universal Audio Arrow,,,,,,,,,,,,
missing_user_id,Computer: Apple MacBook Pro 15&quot;,,,,,,,,,,,,
missing_user_id,DAW: Presous Studio One,,,,,,,,,,,,
missing_user_id,CONVENIENT LOCATION,,,,,,,,,,,,
missing_user_id,West Putney,,,,,,,,,,,,
missing_user_id,IN ADDITION,,,,,,,,,,,,
missing_user_id,Recording &amp; editing assistance upon request.,,,,,,,,,,,,
missing_user_id,2621,Galaxy Studios,NULL,https://www.galaxystudios.com/,+32 (0) 14 31 43 43,https://www.instagram.com/galaxystudiosgroup/,,Belgium,,51.507351,-0.12775799999997162,The GALAXY STUDIOS GROUP is a cluster of companies dedicated to the fine arts of film, music and sound technology.,The GALAXY STUDIOS GROUP is a cluster of companies dedicated to the fine arts of film, music and sound technology. We are situated in Belgium and for more than thirty-five years our studio complex has been a world class beacon of advanced technology for sound recording and film post-production.
missing_user_id,2625,Alison McKay,NULL,https://www.alisonmckay.com,07810 838220,,https://www.youtube.com/channel/UCnaqX6i1hSArgmK95s2EsxA,United Kingdom,Glasgow, Scotland,51.507351,-0.12775799999997162,As one the most well known Scottish female voices, Alison&#039;s warm, professional, educated and trusted tone brings value to any brand.,Over a 20+ year career, I have voiced thousands of radio and television commercials, promos and trailers, telephone on hold and IVR systems, corporate, e-learning and explainer videos. No matter where you are in the world, I will bring professionalism, gravitas and polish to your brand, product or service.
missing_user_id,I also offer production and editing services from a broadcast standard studio.,,,,,,,,,,,,
missing_user_id,2629,Jongerenstem.nl,NULL,https://www.jongerenstem.nl/voice-over/,+31648738377,,,Netherlands,,51.507351,-0.12775799999997162,Young Dutch Voice Over Talent,
missing_user_id,2631,Alastair Cameron,NULL,http://wwww.alastaircameron.eu,+36303561045,,,Hungary,Pusztavacs, Pusztavacs, erd&eacute;szet, 2378 Hungary,47.162494,19.503304100000037,With over 50 audiobooks to his name and countless voiceovers, Alastair has to be one of the most experienced British voices in Budapest.,Alastair is an experienced narrator and audiobook producer with nearly 60 books to his name. As well as narrating audiobooks he has produced voiceovers for adverts, explainer videos, phone systems and other media. Operating from his own studio in Budapest he can either produce audio remotely or travel to your studios.
missing_user_id,2632,Locutor David Rodr&iacute;guez - Spanish Castilian (European Spanish) Voice Over Talent,NULL,https://www.LocutorDavidRodriguez.es,+34611081243,,https://www.youtube.com/user/davidrodriguezvoz,Spain,Calle P&aacute;rroco Eusebio Cuenca, 54, 28045 Madrid, Espa&ntilde;a,40.395061693950794,-3.6873283124999716,Locutor y actor de doblaje - Spanish Castilian (European Spanish) Voice Over Talent. &iexcl;Entregas en 24 horas!,
missing_user_id,2634,ASAP Studio,NULL,http://www.asap-studio.com,+4369919077878,,,Austria,M&ouml;dlinger H&uuml;ttenweg II, 8783, Austria,47.516231,14.550072,Multilingual voice over recordings, native speakers, voice over actors, audio production.,Provider of quality Voice Over recordings in any of the world languages, delivered only by native speakers and professional voice over artists.
missing_user_id,Our international team of more than 900 voice talents, native in 84 different languages, is ready to give voice to your next audio project.,,,,,,,,,,,,
missing_user_id,2636,Jessica-Virginia Mouffok / German Voiceover,NULL,http://german-voiceover.com,+49 177-7525920,https://www.instagram.com/jessica_virginia_mouffok/,,Germany,Grootsruhe 3, 20537 Hamburg, Deutschland,53.5549797,10.0422033,Experienced native german voiceover, 20+ years in the business, age range 16-50 also: child voices, cartoon, accents and dialects and singing,professional native german voice artist for 20+ years now.
missing_user_id,References:,,,,,,,,,,,,
missing_user_id,documentaries, e-learning, commercials, dubbing, jingles, off, narrations, audio guides, audio books, games, on-hold, podcasts and more.,,,,,,,,,,,,
missing_user_id,Clients: (selection),,,,,,,,,,,,
missing_user_id,National TV stations like: ARD, ZDF, NDR, ZDF neo, 3sat, Arte, Deutschlandfunk,,,,,,,,,,,,,
missing_user_id,international clients:,,,,,,,,,,,,
missing_user_id,Opel, Hitachi, Kamps AG, T-Mobile, BB Radio, OTTO, Neckermann, Websense Inc., SAI Global,  Siemens, Allianz, Securitas Direct, Daimler, TechniSat Teledigital AG/Radioropa , Bosch Bamberg, Smart-Trike, Global Blue, Royal Canin, Areva, Husqvarna, Audio Guide Gdansk, Bosch, Open Table, Bible TV, Amapur, Apptus, ERGO, Printless International, Optima Logist,,,,,,,,,,,,
missing_user_id,Games: &ldquo;Guild Wars 2&rdquo;,  Star Wars-The old republic&ldquo;, Deus Ex4-Mankind Devided&ldquo;, Mass Effect Andromeda&ldquo;,   &ldquo;Wild Star&rdquo;, &ldquo;Face Noir&rdquo;, &ldquo;,,,,,,,,,,,,
missing_user_id,Studio:,,,,,,,,,,,,
missing_user_id,Nuendo 12, Cubase Pro 10, Neumann TLM 170 mic, Avalon VT 737 sp preamp, audient id22 audio,,,,,,,,,,,,,
missing_user_id,source connect standard,,,,,,,,,,,,
missing_user_id,Apt SureStream,,,,,,,,,,,,
missing_user_id,Session Link Pro,,,,,,,,,,,,
missing_user_id,2637,Andrew Peters,NULL,http://andrewpetersvo.com/,7973350178,,,United Kingdom,,-33.8688197,151.20929550000005,Andrew Peters is one of the top voice over artists in SE Asia, Australia and New Zealand heard literally by millions everyday. Current voice of Channel News Asia, Dubai Eye, Triple M Classic rock, 101 Events of the 20th Century and much more.,&ldquo;A good voice is a genetic lottery as in being photogenic. The microphone picks up nuances that the ear doesn&rsquo;t hear. You will get people like Andrew Peters&hellip;beautifully modulated, the microphone loves his voice&rdquo;.
missing_user_id,Philip Webster (Fairfax media June 2016),,,,,,,,,,,,
missing_user_id,Andrew Peters is one of the top voice over artists in SE Asia, Australia and New Zealand heard literally by millions everyday.,,,,,,,,,,,,
missing_user_id,The network voice of Channel News Asia SE Asia, station voice of Dubai Eye 103.8 Dubai, brand voice of L&rsquo;Oreal Paris Australia and New Zealand, network voice of radio Triple M classic rock Australia and numerous clients for TV, radio and corporate narrations.,,,,,,,,,,,,
missing_user_id,Andrew also offers the use of his professional studio with Source Connect, phone patch and Skype. The studio is complete with top of the line equipment so you can feel safe in the knowledge that your next voice over will sound great.,,,,,,,,,,,,
missing_user_id,2638,Skogen Studios,NULL,http://skogenstudios.com,16047163499,,,Canada,69 Thurlow St, Vancouver, BC V6E 4S4, Canada,49.2857341,-123.12315530000001,Skogen Studios provides voiceover, music composition, &amp; sound design on global projects. We collaborate with international freelance talent.,Skogen Studios is based in Vancouver, British Columbia, Canada. We serve clients globally and collaborate with international freelance talent. The company is owned and operated by award-winning musician &amp; composer Dale Nichols. We provide voiceover, music composition, sound design, and post-production audio services on creative projects including film, animation, and commercial advertising.
missing_user_id,2640,M.i.l.k. Studios,NULL,https://milkstudios.it,+39 06 20382695,https://www.instagram.com/milkstudiosit/,https://www.youtube.com/user/MindsInALovelyKarma,Italy,Via Francesco Sabatini, 12, 00135 Roma RM, Italy,41.93550800000001,12.436557999999991,Milk is a voice-over, dubbing and post-production studio located in Rome.,
missing_user_id,Italian and International Voice Actors for movies and commercials.,M.i.l.k. is a production and post-production studio that offers Solutions for Video.,,,,,,,,,,,
missing_user_id,Our studio offers both Voice-Over/ADR and Music Licensing Services.,,,,,,,,,,,,
missing_user_id,Post-production | Voice Over | Translation and Localization | Voice Actor Casting,,,,,,,,,,,,
missing_user_id,Music Sync | Original Music Composition | Music Advice | Rights and Licenses Management | Discographic Production,,,,,,,,,,,,
missing_user_id,2641,Sara Quir&oacute;s Voiceover,NULL,https://www.saraquirosvoz.com/,,https://www.instagram.com/saraquirosvoz/?hl=es,https://www.youtube.com/channel/UCxohQ3ngQdQG6m5sETrfw-Q,Spain,Av. de Cervantes, 9, 18008 Granada, Espa&ntilde;a,37.1656747,-3.58915920000004,My voice is warm and deep for narrations, fun, young and sexy for commercials, smooth and professional for presentations.,My equipment:
missing_user_id,Computer: Mac Pro.,,,,,,,,,,,,
missing_user_id,Hardward: Pro Tools,,,,,,,,,,,,
missing_user_id,Microphone: Neumann TL 103,,,,,,,,,,,,
missing_user_id,Preamp: Neve 1073.,,,,,,,,,,,,
missing_user_id,Interface: Apogee sound card duet.,,,,,,,,,,,,
missing_user_id,2645,Chuck Davis Creative,NULL,http://www.chuckdaviscreative.com,(860) 884-0090,,https://www.youtube.com/user/chuckdavisvoiceover,United States,153 Branch Hill Rd, Preston, CT 06365, USA,41.52096239999999,-71.99611700000003,Professional Voiceover and Audio Production studio midway between New York and Boston and close to the Casinos,Fully professional VO studio featuring:
missing_user_id,* Whisperroom Iso-Booth,,,,,,,,,,,,
missing_user_id,* Mics from Sennheiser and Blue,,,,,,,,,,,,
missing_user_id,* Pre-Amps from John Hardy and Avalon,,,,,,,,,,,,
missing_user_id,* Pro-Tools DAW on Mac Pro w/RME interface,,,,,,,,,,,,
missing_user_id,* Source Connect Standard,,,,,,,,,,,,
missing_user_id,* Phone Patch via landline or Skype,,,,,,,,,,,,
missing_user_id,2648,Radio Broadgreen,NULL,www.radiobroadgreen.com,01512520919,,,United Kingdom,South Rd, Liverpool L14 1QB, UK,53.41328600068458,-2.896127168261728,Radio production studios,Radio production studios based at Warmington Lodges Studios in the grounds of Broadgreen Hospital Liverpool (at the end of the M62 motorway).
missing_user_id,Two radio production studios available featuring Neumann U87, Behringer, AKG C414, microphone stock available. Compressor/limiter on all microphone channels - FX can be added.,,,,,,,,,,,,
missing_user_id,Fibre ADSL for Cleanfeed, ipDTL, Fideliphone, Source Connect Now and Skype connectivity. Sessions can be recorded to Adobe Audition/Cool Edit Pro 2/ Audacity for WAV or MP3. Audio file transfer via FTP/Dropbox.,,,,,,,,,,,,
missing_user_id,Pre-bookings only.,,,,,,,,,,,,
missing_user_id,We are a registered charity (England &amp; Wales) and as such, all fees will be deemed as donations to this charity.,,,,,,,,,,,,
missing_user_id,2650,Atlanta Voiceover Studio,NULL,http://www.AtlantaVoiceoverStudio.com,404 350-0006,https://www.instagram.com/atlantavoiceoverstudio/,,United States,800 Forrest St NW, Atlanta, GA 30318, USA,33.7957732,-84.41422999999998,Atlanta VO Studio is a boutique recording studio for voiceover with phone patch &amp; source connect capabilities.,Atlanta VO Studio is a boutique recording studio for voiceover with phone patch &amp; source
missing_user_id,connect capabilities. In addition to recording studio services, Atlanta Voiceover Studio offers workshops, classes and other resources.,,,,,,,,,,,,
missing_user_id,2652,NW Tally Studio,NULL,https://neilwilliamsvoiceover.com,02078594734,,,United Kingdom,12 Highgate Rd, London NW5 1AS, UK,51.5524676,-0.14143239999998514,Male Voice Over Artist with home studio in London. Studio available to hire, 10 minutes from West End built with industry leading equipment.,The studio is built around Neumann u87ai microphone, Avalon amp and Apogee. Fully sound proofed and ready to go. Clients can book the studio for a voice over and then direct the session remotely via ipDTL....or join us, it&#039;ll be cosy and there is a small dog!
missing_user_id,Audio editing available on site.,,,,,,,,,,,,
missing_user_id,2654,Stephanie Matard Voice Over Studio,NULL,https://www.stephaniematard.com/,+33(0)777953364,https://www.instagram.com/smatard/,https://www.youtube.com/channel/UC30graea68ny5ZeyuDhTqvw?view_as=subscriber,France,16 Rue Octave Bonnel, 27110 Le Neubourg, France,49.1481521,0.9028616999999999,American voice over actress in Normandy,Studiobricks VO Edition recording booth
missing_user_id,NEUMANN u87,,,,,,,,,,,,
missing_user_id,pre73 MKIII pre ampli,,,,,,,,,,,,
missing_user_id,Audient ID 14 interface,,,,,,,,,,,,
missing_user_id,Beyerdynamic headphones,,,,,,,,,,,,
missing_user_id,Adobe Audition,,,,,,,,,,,,
missing_user_id,Source Connect, Session link Pro, Zoom, Skype,,,,,,,,,,,,
missing_user_id,2656,Thomas voix off,NULL,https://thomasvoix.com/,0698541415,,https://www.youtube.com/channel/UCuO3MOrpaGD2p5Cmy9D2WDQ,France,39 Rue Dunois, Paris, 75013 Paris, France,48.831312,2.3686864000000014,Com&eacute;dien voix off professionnel, Thomas enregistre sa voix depuis son studio pour la TV, radio, internet etc.,Thomas Dormoy est un com&eacute;dien sp&eacute;cialis&eacute; dans l&#039;enregistrement de voix off.
missing_user_id,Il dispose de son studio professionnel : micro Neumann U87 et Peluso 2247 SE, carte son RME Babyface pro, channel strip Manley Core, enceintes de monitoring et insonorisation professionnelle.,,,,,,,,,,,,
missing_user_id,Il enregistre des voix off pour tout type de projets : pubs t&eacute;l&eacute;, spots radio, films institutionnels, jeux vid&eacute;os, jouets, E-learning, accueil t&eacute;l&eacute;phonique.,,,,,,,,,,,,
missing_user_id,2657,Audiomaxnet,NULL,https://www.audiomaxnet.com/,0039051578669,,https://www.youtube.com/channel/UCc3ge5p0j18IDBCWB2GLMRA,Italy,Via Giuseppe Garibaldi, 49, 40033 Casalecchio di Reno BO, Italy,44.4834953,11.280870700000037,&ldquo;Since 1984 our voices everywhere!&rdquo;,
missing_user_id,Voice Over, dubbing, audio post-production, creativity and copywriter, animation, video editing,AUDIOMAXNET was created from an original idea by Max Martirani, combining his two greatest passions: radio and the &ldquo;voice instrument&rdquo;. On February 7th, 1984, he founded AUDIOMAX. At first the main activity was the production of radio commercials and voice-overs for audiovisual material. Keeping pace with new ideas and technologies, in January 2006 start up AM-NET Communication and AUDIOMAXNET MULTIMEDIA PRODUCTION, the first Italian voice talents network with collaborators located all over the world.,,,,,,,,,,,
missing_user_id,The first of January 2016 was created VOICECOMMUNICATION, the voice talent agency of Audiomaxnet, that offers a fast and intuitive service to search and casting professional native speaker voices, for all languages of the world and at all levels. The service is dedicated to companies, organisations, public authority, advertising agencies and privates.,,,,,,,,,,,,
missing_user_id,AUDIOMAXNET, drawing from its own experience and professionalism, today it&rsquo;s able to create ideas and fundamental services for audiovisual.,,,,,,,,,,,,
missing_user_id,2658,Beth Davison VO,NULL,https://www.bethdavison.com,07854321987,,,United Kingdom,The Atrium, St Georges St, Norwich NR3 1AB, UK,52.63243009999999,1.2942562000000635,Kube Silver Voiceover Booth in the Norwich city centre.,This acoustically treated sound booth is where I record the majority of my voiceover work - and I love to share it with you! Comes with I  a Rode NT1A mic, Focusrite 2i2 pre-amp and MacBook with Adobe Audition. .I can even provide production advice and editing if you&#039;d like or just let you get on with it! If you&#039;re using the studio MacBook we can just WeTransfer you the files at the end of the session.
missing_user_id,2659,Julien Bocher Voix Off,NULL,https://www.julienbocher.com,0617902587,,,France,22 Rue Amp&egrave;re, 92240 Malakoff, France,48.8198405,2.2973246000000245,Enregistrement voix off films institutionnels, corporate, doublages, bandes annonces publicit&eacute;.,Enregistrement de tous projet audiovisuel.
missing_user_id,2660,Hoy Grabo,NULL,https://hoygrabo.com,,,,Spain,Carrer de la Canuda, 47, 08002 Barcelona, Espa&ntilde;a,41.38506389999999,2.1734034999999494,Estudio de locuci&oacute;n online en castellano y catal&aacute;n, m&uacute;sica y sonido para producciones audiovisuales.,Estudio de locuci&oacute;n online en castellano y catal&aacute;n, m&uacute;sica y sonido para producciones audiovisuales.
missing_user_id,Servicios para agencias de publicidad y marketing. Art&iacute;culos, consejos y tutoriales sobre locuci&oacute;n, m&uacute;sica y sonido.,,,,,,,,,,,,
missing_user_id,2663,Haven Recording,NULL,http://www.havenrecording.com/home.html,213-375-8576,https://www.instagram.com/havenrecordingcali/,,United States,1340 E 6th St, Los Angeles, CA 90021, USA,34.0375959,-118.23414309999998,Haven Recording is an 2,100 sq/ft. recording studio in the heart of the downtown Los Angeles Arts District.,We have a 650+ sq/ft. control room so you can work with space and comfort, a 450+ sq/ft. live room with an isolated vocal booth.  TV screens and tie lines in every room so you can record in comfort.
missing_user_id,2664,Absoluta Audio,NULL,http://www.audioabsoluta.com,6125649266,https://www.instagram.com/audioabsoluta/,,United States,2536 Hennepin Ave, Minneapolis, MN 55405, USA,44.9562134,-93.29683849999998,Absoluta Audio is a Full Service Post Production Audio Facility &amp; Recording Studio in Minneapolis. Sound Design &amp; Immersive Sound, + Ads for,In partnership with Black Apple Recording Studio -
missing_user_id,,,,,,,,,,,,,
missing_user_id,We proudly co-operate this power-house of a recording facility,,,,,,,,,,,,
missing_user_id,that has been fully operational for the past eleven years.,,,,,,,,,,,,
missing_user_id,,,,,,,,,,,,,
missing_user_id,Our facility is located 5 minutes from The Walker Museum,,,,,,,,,,,,
missing_user_id,and our studios are an elevator ride away from,,,,,,,,,,,,
missing_user_id,coffee, lunch, and parking.,,,,,,,,,,,,
missing_user_id,,,,,,,,,,,,,
missing_user_id,We master for all formats and deliver for any medium.,,,,,,,,,,,,
missing_user_id,Our facilities are extremely equipped, and our mic locker is fully stacked.,,,,,,,,,,,,
missing_user_id,,,,,,,,,,,,,
missing_user_id,2665,WEENstudio,NULL,http://t.co/wnDz2svv0u,+971528700650,,,United Arab Emirates,Business Bay - Dubai - United Arab Emirates,25.1908323,55.26006480000001,Since 2012, Ween Media has provided over 100+ top quality voice artists spanning over 30 languages.,Since 2012, Ween Media has provided over 100+ top quality voice artists spanning over 30 languages. Our customers across the UAE, Saudi Arabia, Kuwait, Bahrain, Qatar, Oman, Singapore, India, and China. Our voices have been heard on national commercials and on phone systems worldwide more than 1,000+ companies.
missing_user_id,2666,Joy Lyn Shaw VO,NULL,http://joylynshawvo.com,801-602-8283,,,United States,,39.9611755,-82.99879420000002,the voice in the studio,I work out of my home studio in Columbus, OH and record everything from commercials to presentations to phone messages. I can deliver audio electronically or record right into your studio via ISDN, Source Connect or ipDTL.
missing_user_id,2668,Si Johns Voice Over,NULL,http://www.sijohnsvoiceover.com,07967032011,,,United Kingdom,13 St. Augustines Ave, South Croydon CR2 6JN, UK,51.35320309999999,-0.10093860000006316,Simon Johns - British male voice over artist - available for Narrations Explainers, eLearning, animation voices etc.,Simon Johns - voice over - I work from a fully soundproofed, treated Studiobricks booth - equipt with a selection of high-end condenser mics - available at short notice to record scripts for projects raging from E-learning to Explainers - Corporate Narrations to Voice of God   - Video Game characters - to Radio Commercials.
missing_user_id,if you are a VO and find yourself in need of a studio, get in touch - the booth is available in my downtime. I will even lend an outside ear :),,,,,,,,,,,,
missing_user_id,2671,The Gillies Company,NULL,https://www.jamesagillies.com/,07887996400,http://www.instagram.com/james_gillies_actor,https://www.youtube.com/channel/UCG-RXznQl6udrxjBx4_ZcDA?view_as=subscriber,United Kingdom,B9009, Keith AB55 4DB, UK,57.39012020000001,-3.2139532999999574,A full function voice over studio with high speed communications. Suitable for stand alone sessions, uploads and studio to studio hook up.,Favat House, Glenrinnes, Dufftown, Moray AB55 4DE
missing_user_id,When I moved here and discovered that there were no available voice over studios for two hundred miles in any direction, I built my own. I was very self indulgent.,,,,,,,,,,,,
missing_user_id,It consists of two areas.,,,,,,,,,,,,
missing_user_id,A Studiobricks Plus One Vocal Booth equipped with iMac, Focusrite 2i2, Rode NT2A (or DPA 740) mic, Adobe Audition (or Studio 1) DAW and Source-Connect Standard.,,,,,,,,,,,,
missing_user_id,A separate Editing Suite also equipped with iMac, Focusrite 2i2, Rode NT2A (or DPA 740) mic, Adobe Audition (or Studio 1) DAW and Source-Connect Standard.,,,,,,,,,,,,
missing_user_id,With added high speed internet, low studio to studio latency and fast upload speeds are assured.,,,,,,,,,,,,
missing_user_id,If you are in the area enjoying our gorgeous vistas and great hospitality and you need to find a studio asap, give me a ring or drop me an email. I am always happy to step out of the booth and make room for an hour or so.,,,,,,,,,,,,
missing_user_id,2672,Velvet Estudio,NULL,https://velvetestudio.com/,(+57) 8051649,https://www.instagram.com/velvet_estudio/,https://www.youtube.com/user/VelvetEstudio,Colombia,Ak. 15 #93a-84, Bogot&aacute;, Colombia,4.678624999999999,-74.05084099999999,ORIGINAL MUSIC &amp; SOUND POST-PRODUCTION STUDIO.,VELVET STUDIO has been known for offering high quality music and audio content, reaching the televisions, radio stations and websites of Colombians and Latin Americans.
missing_user_id,We create, produce and record jingles, music for commercials, radio spots, digital media, internet or any other medium.,,,,,,,,,,,,
missing_user_id,We have an extensive Book of professional voice talents, versatile and effective. We handle different Colombian accents in Spanish and other languages.,,,,,,,,,,,,
missing_user_id,2674,Apoll 11 Studios,NULL,http://www.apollo11studios.co.uk,,https://www.instagram.com/apollo11studios/,,United Kingdom,The Biscuit Factory, Block F, 100 Clements Rd, Bermondsey, London SE16 4DG, UK,51.494854,-0.06303279999997358,Apollo 11 Studios is a podcast recording studio based in South London that provides high quality audio and visuals at competitive rates.,We are committed to producing high quality audio and visuals for our clients, as well as creating a relaxed atmosphere that allows them to feel as comfortable and free as possible whilst they record. With a personal experience in podcasting and well grounded knowledge in sound engineering, we know just what it takes to create the right environment for recording a podcast.
missing_user_id,We&rsquo;re not exclusive only to podcasts either! Apollo 11 Studios is also available for voiceover recordings as well. Whether it&rsquo;s voiceover work or dubbing, we have you covered!,,,,,,,,,,,,
