reason,user_id,first_name,last_name,url,phone,instagram,youtubepage,location,address,latitude,longitude,shortabout,about
missing_user_id,2320,Chocolate Fox Audiobooks,NULL,http://chocolatefox.co.uk/,07739 126130,,,United Kingdom,Spring Hill Ln, Andover SP11, UK,51.25397607060635,-1.3962497449950888,Boutique UK audiobook producer. Short-listed for Audible Audiobook of the Year.,We invest passionately in our audiobooks; from meticulous preparation and consultation with authors, through painstaking production &amp; proofing and in artful editing &amp; mastering, we seek to accurately capture the very essence of each book.
missing_user_id,2321,The Arabic Voice Over Company,NULL,http://thearabicvoiceover.com,+201004458545,,https://www.youtube.com/channel/UC63OR92i5wLhcgRO0rg1qmg,Egypt,Madenet Al Obour - Madenet Al Rehab, Cairo Governorate, Egypt,30.1198764,31.53549620000001,Founded By Fady Nagy as the first voice over company in middle east.,
missing_user_id,2322,Voiceovers By Trish,NULL,http://voiceoversbytrish.com/,201-317-1058,https://www.instagram.com/voiceoversbytrish/,https://www.youtube.com/user/VoiceoversByTrish,United States,20 Roosevelt Trail, Hopatcong, NJ 07843, USA,40.943317,-74.66705689999998,Full-time pro voice since 2004. Extensive experience in all genres! Bubbly party girl to snarky soccer mom.,WhisperRoom 5-sided Isolation Booth, Sennheiser MKH-416 shotgun microphone, set in a quiet neighborhood. ISDN, phone patch, and Skype available for remote sessions.
missing_user_id,2323,Martin Allanson - VO,NULL,http://www.martinallanson.com,07498 200 905,https://www.instagram.com/martinallanson/,https://www.youtube.com/channel/UCwj7XgL3qfhgBdY33kyriFA,United Kingdom,5 Elvin Gardens, London, Wembley HA9 0GQ, UK,51.5593361,-0.2818118999999797,WARM, YOUNG, VERSATILE, COMEDY, RP,Hi, my name is Martin Allanson and I have been a voiceover artist for the last 10 years. You can see some of the brands I have worked for on this page, https://martinallanson
missing_user_id,If you have any questions regarding me or the studio please do not hesitate to get in contact, info@martinallanson.com,,,,,,,,,,,,
missing_user_id,2337,Reynaldo Infante,NULL,http://reynaldoinfante.com,+1 809 616 2111,,,Dominican Republic,Calle Paseo Las Palmas, Santo Domingo, Rep&uacute;blica Dominicana,18.48973689974473,-69.93611311611329,Voiceover, Radio &amp; TV personality with over 22 years of experience and CEO and founding partner of WorldVoices SRL, audio production company,VO for radio and tv spots, narrations,  eLearning, audiobooks, dubbing, animation, video games, We also provide these services: ADR, foley, sound design and mixing and editing.
missing_user_id,We do Voiceover Coaching services for executive and voiceovers in Neutral Spanish,,,,,,,,,,,,
missing_user_id,2338,World Voices,NULL,http://worldvoices.com.do,+1 809 616 2111,,,Dominican Republic,Calle Los Conquistadores 11, Santo Domingo, Dominican Republic,18.4990073,-69.9504205,Spots de Radio y TV, Doblaje de Spots, Localizaci&oacute;n de Comerciales, Lip Sync, Narraci&oacute;n de Documentales,Grabaci&oacute;n de Voces, Producci&oacute;n de Spots de Radio y TV, ADR, Doblaje, Casting de Voces, Direcci&oacute;n de Talentos, Sound Design, Sound App Design, Subtitulado, Traducciones de Materiales a Locutar
missing_user_id,2340,Sound4VO,NULL,http://sound4vo.com,828-551-0891,,,United States,Unnamed Road, Grenfell, SK S0G 2B0, Canada,50.484051059540576,-102.91584393749997,DAN FRIEDMAN &ndash; Producer, Audio Engineer, Author and Voice Talent,Dan lives in the beautiful mountains of Asheville, NC and is a husband and father of 2 boys. He attended five universities and had three majors before being introduced to audio engineering in 1994. Realizing his career dream, he ended his educational journey at The Recording Workshop in Chillicothe,
missing_user_id,2341,Sound4VO,NULL,http://Sound4VO.com,8285510891,,,United States,3 Glenn Bridge Rd, Arden, NC 28704, USA,35.4661613,-82.51669820000001,,
missing_user_id,2343,Victoria&#039;s Voiceover,NULL,https://vicsvoice.com,972-54-4646370,,,Russia,9M6WJC59+HR,54.60896023611881,98.41960528125003,Professional American English Voiceovers,You have a project that requires professional voiceover in US English, and you want it to sound just right: with expert voiceover, the perfect tone and pace, and high-quality audio.
missing_user_id,I&#039;m Victoria Feinerman, an experienced and professional American voiceover talent whose voice has enhanced hundreds of projects around the globe, and I&#039;m happy to be of service!,,,,,,,,,,,,
missing_user_id,2349,Pro Soul / CYTC Studios,NULL,http://prosoul.com,,,,China,11 Fu Qian Er Jie, Shunyi Qu, Beijing Shi, China,40.0647331,116.58083209999995,Our studio is experienced and top quality for Chinese voiceover, voice acting, recording,  post production sound design, editing and mixing,RECORDING
missing_user_id,Neumann mics through UA tube preamps, booth large enough for full live band/choir.,,,,,,,,,,,,
missing_user_id,Multi language voice work &amp; film foley, Classic synthesizers, Pro Tools 11,,,,,,,,,,,,
missing_user_id,SOUND DESIGN,,,,,,,,,,,,
missing_user_id,From computer games &amp; mobile apps  to real Boeing flight simulators, to full feature films &amp; short films for companies like VW, Huawei, Audi, Blackberry, &amp; Dakele,,,,,,,,,,,,
missing_user_id,2350,Playground Estudio,NULL,https://playgroundestudio.com,,,,Spain,Plaza Puerta del Sol, 11, 28013 Madrid, Spain,40.4167754,-3.7037901999999576,Audio Recording &amp; Post Production based in Madrid Spain,PLAYGROUND ESTUDIO IS THE EXPRESSION OF THE PASSION WE FEEL FOR OUR FIELD. THE PASSION FOR THINGS WELL DONE, FOR BEAUTY AND PERFECTION.
missing_user_id,It is a workshop where sound sculptures are made to live in the mind of the spectator: we are an auteur shop.,,,,,,,,,,,,
missing_user_id,2351,KerSound-Studios,NULL,http://www.shanghaivoiceover.com/,+8621 6386-5218,,,China,751 Huang Pi Nan Lu, Huangpu Qu, Shanghai Shi, China,31.21313,121.47738900000002,Your Voice Over &amp; Dubbing partner in Shanghai, China, since 2010!,Located in downtown Shanghai, KER SOUND Studios is a boutique audio post-production facility, music production and licensing agency with more than 10 years of experience in the TV, Film and Video Game industry.
missing_user_id,Our voice talent database covers mainly Chinese Mandarin, Cantonese, English &amp; Japanese.,,,,,,,,,,,,
missing_user_id,2352,Michael Valente - Voiceover Talent,NULL,http://www.valentevoiceover.com,2036714099,,,United States,539-585 N High St, East Haven, CT 06512, USA,41.2965034,-72.86384240000001,American Voiceover Talent specializing in Explainer Videos, Commercials and Telephony projects.,American Male Voiceover Talent with a guy-next-door, friendly and conversational delivery. Home recording studio with industry standard equipment and recording software. For demos and contact information visit www.valentevoiceover.com
missing_user_id,2353,British Voice Diva LLC,NULL,https://britishvoicediva.com/,4042634955,https://www.instagram.com/britishvoicediva/,,United States,4174 Summit Way, Marietta, GA 30066, USA,34.0493653,-84.4618533,US based British Voice with Isolation booth Home Studio with Source Connect Standard 3.9,
missing_user_id,2360,David Dub Studio,NULL,,8098010871,https://www.instagram.com/daviddubtejeda,,Dominican Republic,Calle Santiago, Santo Domingo, Rep&uacute;blica Dominicana,18.462432,-69.9117506,Voice talent and audio producer,Profesional de la voz con mas de 4 a&ntilde;os de experiencia. Trabajo desde mi home studio el cual cuenta con los standares de calidad necesarios para grabaciones profesionales
missing_user_id,2363,,NULL,http://www.echo-magic.com,,,,United States,400-452 E Ojai Ave, Ojai, CA 93023, USA,34.4480495,-119.24288899999999,Echo Magic continues to provide award winning sound to a solid list of existing clients,Echo Magic Studios provides an inspiring, creative, retreat &shy;style audio finishing center in the Ojai Valley. The area is extremely accessible, yet just removed from the busy day&shy;-to-&shy;day hustle of Los Angeles. Technically, the studio is competitive with any major house in Los Angeles or New York.
missing_user_id,2368,Essex Recording Studios LTD,NULL,http://www.essexrecordingstudios.com,+447455251112,https://www.instagram.com/essexrecordingstudios,http://www.youtube.com/essexrecordingstudios,United Kingdom,19 Clifftown Rd, Southend-on-Sea SS1 1AB, UK,51.53676069999999,0.7119131999999999,Essex Recording Studios offers world class recording for TV &amp; radio! Our equipment is the best of the best and our staff is here to help!,Essex Recording Studios is a world class recording facility located in the former Global Radio &amp; Daily Mail headquarters building in Southend-on-Sea, Essex directly opposite Southend Central station. Our clients range from international Grammy-nominated recording artists, to authors recording audio books, podcasters and tv/film voiceover professionals. We offer the full spectrum of audio recording services to meet any requirements.
missing_user_id,Our control room features the flagship SSL Duality Delta 48 channel mixing console with monitoring accomplished via a pair of Barefoot MicroMain27&#039;s and Atomic SixTen&#039;s. We have the finest microphone collection in the country, including the full range from Neumann. We have the most extensive mic-preamp collection in the country as well, guaranteeing we can match the perfect microphone and preamps for any voiceover talent.,,,,,,,,,,,,
missing_user_id,2369,Forest Studios Lebanon,NULL,http://www.forest-studios.com,00961 3 272270,,https://www.youtube.com/foreststudioslebanon,Lebanon,VGHP+6MR, Lebanon,33.8783554,35.536711,Forest Studios:Shooting Stages - Recording Studio - Voice Over - Casting Department- Wardrobe &amp; Props - Set Building facility,Our clients are artists, composers, filmmakers and advertising agencies.
missing_user_id,Forest audio studio is multi-purpose studio for your composing and recording requirements.,,,,,,,,,,,,
missing_user_id,Once you&rsquo;ve dealt with our friendly and very well experienced sound engineers and composers you will know why our clients return to us again and again.,,,,,,,,,,,,
missing_user_id,From voice over talents, sound effects library composition, music composition to sound designing for films, TVCs and Video Clips&hellip;,,,,,,,,,,,,
missing_user_id,2372,Augusto Casanovas,NULL,https://vimeo.com/user4316516,+34 645423382,,,Spain,,41.396308139073774,2.146555400000125,Voiceover Studio located in Barcelona. Voiceover demo production. Worldwide clients.,Productor e ingeniero de sonido especializado en locuci&oacute;n y doblaje. M&aacute;s de 10 a&ntilde;os trabajando para diferentes estudios, productoras y agencias.
missing_user_id,2374,BirdBoxVox: Piers Gibbon&#039;s Studio (with overnight accommodation),NULL,http://www.piersgibbon.com/studio,,,,France,93 Rue de la Lib&eacute;ration, 47200 Marmande, France,44.500484,0.159869,Purpose-built Esmono voiceover studio (VoxBox) with overnight accommodation available.,Piers Gibbon owns and runs a broadcast quality voiceover (and publicity interview) recording studio with overnight accommodation available at his home. Here, he records voiceovers and also does publicity and down-the-line interviews via ISDN, Source Connect, SourceConnectNow, high quality Skype video, ipDTL and AudioTX via aptx and IP. The studio has been validated by many broadcasters, as well as the studios of Source Connect.
missing_user_id,2375,On-Air Studios,NULL,http://www.voiceoveruniverse.com/profile/JaimeAlfredoNunez,+56966032834,,,Chile,Del Carb&oacute;n 200-298, Limache, Regi&oacute;n de Valpara&iacute;so, Chile,-33.0095283,-71.25958880000002,Servicios de locuci&oacute;n en Espa&ntilde;ol Latinoamericano Neutro - Estudio de grabaci&oacute;n de audio - Latin American Neutral Spanish Voice Over,On-Air Studios es el estudio de grabaci&oacute;n de audio dirigido por el locutor internacional Jaime Alfredo N&uacute;&ntilde;ez desde 1991 y la gerente de cuentas Elisa De Simone quien se integr&oacute; en 2004 como programadora web y productora.
missing_user_id,El equipo On-Air se ocupa de brindar servicios de  locuci&oacute;n profesional en espa&ntilde;ol latinoamericano neutro y post producci&oacute;n de audio a radios, canales de tv, agencias y empresas de todo el mundo de habla hispana.,,,,,,,,,,,,
missing_user_id,2377,Such A Voice,NULL,https://www.suchavoice.com/services/voice-over-training/,802-275-0154,,,United States,142 Dorset St, South Burlington, VT 05403, USA,44.4648937,-73.17940010000001,Such A Voice helps you to start your voice over career the right way.,Such A Voice has been helping aspiring voice-over artists launch their careers for over 25 years. We diligently work to stay on top of industry trends, challenge our clients to take their voices to the next level, are selective who we work with and offer lifetime support for all our clients.
missing_user_id,2380,Carlos Conde - Voice over &amp; Production,NULL,http://www.locutorcarlosconde.com,,,https://www.youtube.com/user/Carloscondef,Spain,,39.63601119999999,2.6473508000000265,Natural, trustworthy, professional for training, business presentation, sales, and web sites.,Voice over for radio, television and internet videos, corporate videos, presentations, e-learning, internal videos, product videos, explanatory videos, switchboards, public address systems, apps. I offer these online voice over services daily from my speech studio Carlos Conde - Voice over &amp; production for radios, brands, businesses, entrepreneurs, businesses, individuals, agencies, publishers, producers and national and international.
missing_user_id,2381,Feel The Voice,NULL,http://www.feelthevoice.com,00385989282190,,,Croatia,,44.1073787,15.242981800000052,High quality, clear, articulate and positive young adult / middle aged non-regional Croatian voiceover.,High quality, clear, articulate and positive young adult/middle aged non-regional Croatian or eastern European English voice-over. Over 14 years of radio &ldquo;on-air&rdquo; and audio recording experience. Worked for many well know companies such as EU Commission, LEGO, Lidl, Kaufland, Milka, Turkish Airlines, WIZZ Air, LOT Airlines, T-Mobile, Pfizer, Porche, Volvo, Nike, Bosch to name just a few.
missing_user_id,2382,ALXVoice,NULL,https://www.alexkovalvoice.com,+79236583007,,https://www.youtube.com/watch?v=cmD-YToc3g0&amp;list=UU48uG7jnkhx3L31m5D_vqCw,Russia, , 76, ,  , , 656064,53.34224822827688,83.70170214404311,Native Russian Voice Over Talent,I am a native Russian Voice Talent with over 20 years of experience, both as a Voice Talent and an Audio Producer.
missing_user_id,Among my credits are tens of thousands of commercials and hundreds dubbed films, both corporate and documentary.,,,,,,,,,,,,
missing_user_id,If you are looking for an accurate and knowledgeable Russian voice talent or production studio&#039;s services don&rsquo;t hesitate to contact me.,,,,,,,,,,,,
missing_user_id,I am at your disposal.,,,,,,,,,,,,
missing_user_id,2383,www.spreker.be Dutch VO Belgium for Antwerp,Brussels, Mechelen.,NULL,http://www.spreker.be,+32478883132,,,Belgium,Muizenvaart 1, 2812 Mechelen, Belgi&euml;,51.00948589999999,4.492060100000003,Welcome to Brussels North.,
missing_user_id,10 minutes by train from airport Brussels or Antwerp to Mechelen / Muizen,Voice-booth with Neuman u-87, Neuman tlm 103, Brauner Phantera, Sennheiser MKH 418 microphone RME I/O convertor or prism sound and audition or protools DAW, waves diamant bundle.,,,,,,,,,,,
missing_user_id,2389,SoundWaves Studio,NULL,https://www.soundwaves.cz,+420776620777,,,Czech Republic,Malinovsk&eacute;ho n&aacute;m. 4, 602 00 Brno-sted, ,49.19551370000001,16.614083299999947,Native Czech and Slovak voce over. Synchronization is included!,Synchronization is included.
missing_user_id,Large tonal range.,,,,,,,,,,,,
missing_user_id,Provides help with language and grammar.,,,,,,,,,,,,
missing_user_id,48 hour turnaround.,,,,,,,,,,,,
missing_user_id,Brands we have voiced for include Adidas, Ford, VW, Turkish Airlines, Lidl, Shimano, Viessmann, Kimberly-Clark, Amazon, Iveco, FedEx, Sinology, Shell, Kogel, Sunwings, Harley-Davidson, Burger King, Seat and many more.,,,,,,,,,,,,
missing_user_id,2394,Voicebooking.com&#039;s Voiceover Studio,NULL,https://www.voicebooking.com,0031 (0)20 77 47 323,,https://www.youtube.com/channel/UCjN-KROdV1x4rH8anZvBdYg,Netherlands,Krijn Taconiskade 286, 1087 HW Amsterdam, Nederland,52.3522353,5.004352799999992,Our studio is fully tailored for voiceover recordings and has plenty of room to invite clients. Online connections and dial-in available.,
missing_user_id,2399,TGM Media Ltd,NULL,http://www.tommarshallvoiceover.co.uk,07817632222,,,United Kingdom,9 Walley&#039;s Dr, Newcastle ST5 0NG, UK,53.01824190000001,-2.214203399999974,North Staffordshire production and voiceover studio with ISDN and Source Connect.,Just 10 minutes from Junctions 15 and 16 of the M6 in Staffordshire, this studio is ideal for voiceovers as well as production.
missing_user_id,Connect to anywhere in the world with ISDN, Source Connect or Skype.,,,,,,,,,,,,
missing_user_id,Available 7 days a week with a producer.,,,,,,,,,,,,
missing_user_id,2400,Lisa Graydon Studio,NULL,https://lisagraydon.com,07956833428,,,United Kingdom,24A Hill House Cl, Church Hill, London N21 1LG, UK,51.6358366,-0.1057898,Source Connect Standard studio in beautiful North London village, 6 mins from station.,
missing_user_id,Studio has desk, KRK speakers and large booth,Sennheiser MK4 &amp;&nbsp;Audio Technica AT4033&nbsp;&nbsp;,,,,,,,,,,,
missing_user_id,HeDT 770 Pro Limited Editions x2&nbsp;,,,,,,,,,,,,
missing_user_id,Golden Age Pre 73,,,,,,,,,,,,
missing_user_id,Scarlett 2i2 Interface&nbsp;&nbsp;,,,,,,,,,,,,
missing_user_id,Logic X 10.4.2&nbsp;&nbsp;,,,,,,,,,,,,
missing_user_id,Mac Mini -&nbsp;Intel Core i5 -&nbsp;2.6 GHz - 8 GB,,,,,,,,,,,,
missing_user_id,2401,Sean O. Shea,NULL,http://seanoshea.net,,,,United States,Moodus, CT 06469, USA,41.5028768,-72.4500867,I help businesses get noticed by providing them with professional voice overs for their commercial,  training videos, and voice mail.,I help businesses get noticed by providing them with professional voice overs for their commercial, narration, e-learning, voice mail and training videos so they can reach their target audience.
missing_user_id,Hey, let&#039;s face it........ time is money and some of the greatest work is done &quot;after hours&quot;. With a professional quality in-home studio, I have the ability to record when YOU need me and then transfer the finished project to you over the internet right away, so you can get on with your day (or night).,,,,,,,,,,,,
missing_user_id,Send me your script for a fast, FREE audition!,,,,,,,,,,,,
missing_user_id,2402,Audio Tango,NULL,http://www.audiotango.com,877-284-7876,,,United States,777 NW Wall St., Suite 108, Bend, OR 97703, USA,44.0580016,-121.31566889999999,Audio Tango offers professional voice-over talent for radio commercials, e-Learning narration, on hold/IVR messaging - anything audio.,Audio Tango offers professional voice-over talent for radio commercials, e-Learning narration, on hold/IVR messaging - anything audio. ISDN/Source-Connect equipped and complete sound design services.
missing_user_id,2404,M-Studio Bhutan,NULL,http://www.mstudiobhutan.weebly.com,00975 77108955,http://www.instagram.com/mstudiobhutan,http://www.youtube.com/MStudioBhutan,India,Babesa-Thimphu Expressway, Thimphu, Bhutan,27.4539634,89.65093109999998,Music and recording studio based in Thimphu, Bhutan,We provide services in the the field of music production, song recordings, mixing, mastering, voice overs, narrations and music videos.
missing_user_id,2405,Marina Moll&aacute;,NULL,http://www.marinamolla.com,0034 630830110,,,Spain,,37.1816253,-3.611714099999972,Professional Spanish voice over (Castilian) from Spain. Count on me for advertising, multimedia and elearning voice over projects!,I offer:
missing_user_id,Voice recording in Home Studio (Neumann TLM103, BabyFacePro, Adobe Audition, Mac and Windows, etc.),,,,,,,,,,,,
missing_user_id,Translation (copy translation) from English or Italian to Spanish.,,,,,,,,,,,,
missing_user_id,2406,Voicesther,NULL,http://voicesther.com,+447866716648,,,United Kingdom,109 Topstreet Way, Harpenden AL5 5TY, UK,51.8105646,-0.3392827000000125,Breathing Language into Life,
missing_user_id,,In order to produce high quality audio I have built a bespoke studio through Swiftorg.co.uk which includes acoustic glass and additional acoustic treatment.,,,,,,,,,,,
missing_user_id,Inside my beautiful studio I have all the equipment ready and waiting to bring your language to life:,,,,,,,,,,,,
missing_user_id,Studiobricks One Vocal Booth,,,,,,,,,,,,
missing_user_id,IMac,,,,,,,,,,,,
missing_user_id,SE2200aii  Microphone,,,,,,,,,,,,
missing_user_id,SE Double Pop Filter,,,,,,,,,,,,
missing_user_id,Focusrite Saffire Pro 14 Interface,,,,,,,,,,,,
missing_user_id,dvx 286s Processor,,,,,,,,,,,,
missing_user_id,Beyerdynamic DT770 Pro Headphones,,,,,,,,,,,,
missing_user_id,KRK Rokit 5 Speakers,,,,,,,,,,,,
missing_user_id,2407,Narratable,NULL,https://narratable.co.uk,07912 686473,https://www.instagram.com/narratableuk/,,United Kingdom,7 Jersey Cl, Congleton CW12 3TW, UK,53.1598209,-2.190369,Narratable is a professional recording studio located in Congleton, Cheshire just a 5 minute walk from the Train Station,We&#039;re located in Congleton, Cheshire, just a 5 minute walk from the Train Station and about a 15 minute drive from J17 of the M6. Studio comes with an Engineer with over 20 years of experience at your disposal to make the experience as stress free as possible. The Podcast studio is acoustically treated. The voice booth is acoustically treated and uses top of the range equipment. We can link with clients via Cleanfeed and Zoom/Teams.
missing_user_id,2408,eraX sound art,NULL,https://www.eraxsound.com,07378147192,,,United Kingdom,51 Ruskin Ave, Welling DA16 3QQ, UK,51.4641742,0.10180500000001302,Creative musician and sound designer, experienced in voiceover recording, theatre sound and band production.,I&#039;m a sound engineer with more than 10 years of experience in designing audio for the theatre. If you are an actor and looking for a voice-reel to promote yourself, I can help you. As I have written and directed plays I am very familiar with the needs of actors and how they wish to present themselves professionally.
missing_user_id,I am also a very experienced musician and am happy to take on bespoke music creation for specific events (e.g. weddings) or soundtrack work and will work closely with you to achieve your specific vision.,,,,,,,,,,,,
missing_user_id,I offer a friendly, relaxed atmosphere as well as competitive pricing (with no hidden extras).  My purpose built studio (in the grounds of my house) allows me to keep my prices well below central London studio rates.,,,,,,,,,,,,
missing_user_id,I&#039;m in Welling, south east London - 25 minutes from London Bridge  and 15 minutes from Dartford by train. Availability by appointment.,,,,,,,,,,,,
missing_user_id,Examples of previous work can be found here:,,,,,,,,,,,,
missing_user_id,https://soundcloud.com/eraxsoundart,,,,,,,,,,,,
missing_user_id,2412,Such A Voice,NULL,https://www.suchavoice.com/services/voice-over-classes/,802-275-0154,,,United States,142 Dorset St, South Burlington, VT 05403, USA,44.4648937,-73.17939999999999,,Such A Voice has been helping aspiring voice-over artists launch their careers for over 25 years. We work diligently to stay on top of industry trends while challenging our clients to take their voices to the next level. Our services include voice over training, demo production, classes and more.
missing_user_id,2413,Sound Circus,NULL,http://www.soundcircus.nl,+31 6 23839118,,,United Kingdom,Pieter Nieuwlandstraat 72A, 1093 XX Amsterdam, Netherlands,52.3618759,4.9289463999999725,Recording Facilities in The Netherlands,Music studio
missing_user_id,2 recording rooms,,,,,,,,,,,,
missing_user_id,1 vocal booth,,,,,,,,,,,,
missing_user_id,2 control rooms,,,,,,,,,,,,
missing_user_id,115 m2 and more,,,,,,,,,,,,
missing_user_id,location: Rijen,,,,,,,,,,,,
missing_user_id,2414,80 Hertz Studios,NULL,https://www.80hertz.com/,0161 850 8088,https://www.instagram.com/80hertz/,,United Kingdom,&bull; The Sharp Project, Thorp Rd, Manchester M40 5BJ, UK,53.5013595,-2.1956133999999565,High end music and post production audio services.,We specialise in voice over recording, post production, ADR and have a high end music recording service.  Down the line&rsquo; sessions available via ISDN, Source Connect, Skype &amp; Phone Patch. Previous clientele have included will.i.am, Bjork, Channel 4, BBC, Warner Bros, ITV, Adidas and more.
missing_user_id,2415,Abacus,NULL,https://abacus.nyc,,,,United States,630 9th Ave, New York, NY 10036, USA,40.75996079999999,-73.99112930000001,ABACUS ENTERTAINMENT IS A MEDIA PRODUCTION COMPANY,
missing_user_id,SPECIALIZING IN COMPLETE STUDIO MANAGEMENT OF VIDEO &amp; AUDIO PRODUCTION.,Multimedia Services for the Performing Arts - Voice Over Instruction, Demos, Actor Reels, Audio/Video Production, Editing &amp; Recording. Voiceover casting.,,,,,,,,,,,
missing_user_id,2418,Imagesound,NULL,https://www.imagesound.com/,,,,United Kingdom,B6050, Chesterfield S41 8NL, UK,53.26325989999999,-1.4366281999999728,Crafting brand experiences through sound and vision,Ever found yourself humming along to music in a store?
missing_user_id,Enjoyed the tunes in a bar so much you&rsquo;ve stayed for another drink or found yourself smiling as you enter a clothes shop and your favourite song comes on?,,,,,,,,,,,,
missing_user_id,At Imagesound, we&rsquo;re the people behind those experiences.,,,,,,,,,,,,
